{
  "$schema": "https://json-schema.org/draft/2020-12/schema",
  "type": "object",
  "properties": {
    "schema_version": {
      "type": "string",
      "const": "1.0.0"
    },
    "id": {
      "type": "string",
      "format": "uuid",
      "pattern": "^([0-9a-fA-F]{8}-[0-9a-fA-F]{4}-[1-8][0-9a-fA-F]{3}-[89abAB][0-9a-fA-F]{3}-[0-9a-fA-F]{12}|00000000-0000-0000-0000-000000000000|ffffffff-ffff-ffff-ffff-ffffffffffff)$"
    },
    "session_id": {
      "type": "string",
      "format": "uuid",
      "pattern": "^([0-9a-fA-F]{8}-[0-9a-fA-F]{4}-[1-8][0-9a-fA-F]{3}-[89abAB][0-9a-fA-F]{3}-[0-9a-fA-F]{12}|00000000-0000-0000-0000-000000000000|ffffffff-ffff-ffff-ffff-ffffffffffff)$"
    },
    "owner_id": {
      "type": "string",
      "format": "uuid",
      "pattern": "^([0-9a-fA-F]{8}-[0-9a-fA-F]{4}-[1-8][0-9a-fA-F]{3}-[89abAB][0-9a-fA-F]{3}-[0-9a-fA-F]{12}|00000000-0000-0000-0000-000000000000|ffffffff-ffff-ffff-ffff-ffffffffffff)$"
    },
    "severity": {
      "type": "string",
      "enum": [
        "info",
        "warning",
        "critical"
      ]
    },
    "code": {
      "type": "string",
      "enum": [
        "connected_without_media",
        "media_silence",
        "modality_lost",
        "recovery_requested",
        "recovery_failed",
        "connect_timeout",
        "clock_skew",
        "session_partial",
        "session_failed"
      ]
    },
    "message": {
      "type": "string",
      "minLength": 1,
      "maxLength": 500
    },
    "raised_at_ms": {
      "type": "integer",
      "minimum": 0,
      "maximum": 9007199254740991
    },
    "resolved_at_ms": {
      "anyOf": [
        {
          "type": "integer",
          "minimum": 0,
          "maximum": 9007199254740991
        },
        {
          "type": "null"
        }
      ]
    }
  },
  "required": [
    "schema_version",
    "id",
    "session_id",
    "owner_id",
    "severity",
    "code",
    "message",
    "raised_at_ms",
    "resolved_at_ms"
  ],
  "additionalProperties": false
}
